{
  "$schema": "http://json-schema.org/draft-07/schema#",
  "title": "src/data/btech_students.json",
  "type": "object",
  "properties": {
    "$schema": {
      "type": "string"
    },
    "_help": {
      "type": "array",
      "items": {
        "type": "string"
      },
      "description": "Notes for whoever edits this file. Ignored when the site is built."
    },
    "b15": {
      "type": "array",
      "items": {
        "type": "string"
      }
    },
    "b16": {
      "type": "array",
      "items": {
        "type": "string"
      }
    },
    "b17": {
      "type": "array",
      "items": {
        "type": "string"
      }
    },
    "b18": {
      "type": "array",
      "items": {
        "type": "string"
      }
    },
    "b19": {
      "type": "array",
      "items": {
        "type": "string"
      }
    },
    "b20cse": {
      "type": "array",
      "items": {
        "type": "string"
      }
    },
    "b20ec": {
      "type": "array",
      "items": {
        "type": "string"
      }
    }
  },
  "additionalProperties": false
}
